{
  "schemaVersion": 1,
  "slug": "forward-deployed-engineering-lab",
  "roleSlug": "forward-deployed-engineer",
  "publicationSlug": "forward-deployed-engineering",
  "title": "Forward Deployed Engineering Lab",
  "subtitle": "Practice the decisions between an ambiguous request and an ownable production path",
  "description": "A provider-neutral guided lab course for practicing evidence-led discovery, bounded implementation, failure diagnosis, release and recovery, stabilization, and customer ownership with a fully synthetic deployment.",
  "author": "Komal Nakrani",
  "language": "en",
  "status": "published",
  "optional": true,
  "delivery": "self-paced-guided-lab",
  "level": "professional",
  "durationMinutes": 600,
  "prerequisites": [
    "Comfort reading JavaScript modules and command-line test output.",
    "Familiarity with APIs, data contracts, authorization, testing, and production operations.",
    "A local Node.js 20 or newer runtime; no cloud account or external service is required."
  ],
  "outcomes": [
    "Convert an underspecified request into a bounded outcome, authority map, and evidence plan.",
    "Diagnose contract, identity, data, policy, model, dependency, and reconciliation failures without hiding unknown state.",
    "Assemble verification, telemetry, release, recovery, and readiness evidence into an explicit disposition.",
    "Run a synthetic incident and transfer operation, access, decisions, change, and support without retaining hidden dependency.",
    "Defend a complete capstone dossier while preserving limitations and rejecting unsupported production claims."
  ],
  "certificationPolicy": "Optional Komal learning material. Not required by Abhyaas. NOT FOR LIVE CERTIFICATION BANK.",
  "labKit": {
    "entry": "lab-kit/run.mjs",
    "testsDirectory": "lab-kit/tests",
    "runCommand": "npm run course:fde -- --module 01",
    "testCommand": "npm run test:course:fde"
  },
  "modules": [
    {
      "order": 1,
      "id": "FDE-M01",
      "slug": "frame-a-deployed-outcome",
      "title": "Frame a Deployed Outcome",
      "summary": "Turn a chatbot-shaped request into a bounded workflow claim, authority map, discovery plan, and stop conditions.",
      "minutes": 90,
      "sourceFile": "modules/frame-a-deployed-outcome.mdx",
      "labId": "FDE-LAB-01",
      "labCommand": "npm run course:fde -- --module 01",
      "objectiveIds": ["FDE-K01", "FDE-K02", "FDE-K03", "FDE-K12"],
      "modalities": ["demonstration", "guided-lab", "debugging", "scenario-walkthrough", "project-checkpoint"]
    },
    {
      "order": 2,
      "id": "FDE-M02",
      "slug": "bind-the-real-boundary",
      "title": "Bind the Real Boundary",
      "summary": "Trace a representative intent through contracts, identity, data, environment, dependencies, ownership, and controlled failure.",
      "minutes": 105,
      "sourceFile": "modules/bind-the-real-boundary.mdx",
      "labId": "FDE-LAB-02",
      "labCommand": "npm run course:fde -- --module 02",
      "objectiveIds": ["FDE-K03", "FDE-K04", "FDE-K05", "FDE-K06", "FDE-K08"],
      "modalities": ["demonstration", "guided-lab", "debugging", "scenario-walkthrough", "project-checkpoint"]
    },
    {
      "order": 3,
      "id": "FDE-M03",
      "slug": "bound-ai-and-prove-behavior",
      "title": "Bound AI and Prove Behavior",
      "summary": "Place a model inside deterministic policy, qualified approval, segmented evaluation, traceable verification, and explicit limitations.",
      "minutes": 105,
      "sourceFile": "modules/bound-ai-and-prove-behavior.mdx",
      "labId": "FDE-LAB-03",
      "labCommand": "npm run course:fde -- --module 03",
      "objectiveIds": ["FDE-K05", "FDE-K06", "FDE-K07", "FDE-K08", "FDE-K09"],
      "modalities": ["demonstration", "guided-lab", "debugging", "scenario-walkthrough", "project-checkpoint"]
    },
    {
      "order": 4,
      "id": "FDE-M04",
      "slug": "operate-release-and-recover",
      "title": "Operate, Release, and Recover",
      "summary": "Connect promise-linked signals to diagnosis, progressive release, migration evidence, restoration, and an honest recovery rehearsal.",
      "minutes": 105,
      "sourceFile": "modules/operate-release-and-recover.mdx",
      "labId": "FDE-LAB-04",
      "labCommand": "npm run course:fde -- --module 04",
      "objectiveIds": ["FDE-K05", "FDE-K06", "FDE-K08", "FDE-K09", "FDE-K10"],
      "modalities": ["demonstration", "guided-lab", "debugging", "scenario-walkthrough", "project-checkpoint"]
    },
    {
      "order": 5,
      "id": "FDE-M05",
      "slug": "stabilize-and-transfer-ownership",
      "title": "Stabilize and Transfer Ownership",
      "summary": "Work inside accountable incident command, correct systemic conditions, diagnose adoption friction, and prove customer capability and access exit.",
      "minutes": 90,
      "sourceFile": "modules/stabilize-and-transfer-ownership.mdx",
      "labId": "FDE-LAB-05",
      "labCommand": "npm run course:fde -- --module 05",
      "objectiveIds": ["FDE-K01", "FDE-K05", "FDE-K09", "FDE-K10", "FDE-K11", "FDE-K12"],
      "modalities": ["demonstration", "guided-lab", "debugging", "scenario-walkthrough", "project-checkpoint"]
    },
    {
      "order": 6,
      "id": "FDE-M06",
      "slug": "defend-the-deployment-dossier",
      "title": "Defend the Deployment Dossier",
      "summary": "Integrate the course evidence into a capstone disposition, ownership decision, reuse boundary, and portfolio-level communication.",
      "minutes": 105,
      "sourceFile": "modules/defend-the-deployment-dossier.mdx",
      "labId": "FDE-LAB-06",
      "labCommand": "npm run course:fde -- --module 06",
      "objectiveIds": ["FDE-K01", "FDE-K03", "FDE-K05", "FDE-K07", "FDE-K09", "FDE-K10", "FDE-K11", "FDE-K12"],
      "modalities": ["demonstration", "guided-lab", "debugging", "scenario-walkthrough", "project-checkpoint", "capstone"]
    }
  ]
}
